0,Object ID,Title,Post Type,Author,Created At,URL,Points,Number of Comments
2294635,16043786,Top Hacker News Books in 2017,story,0x54MUR41,2018-01-01 0:06,https://hackernewsbooks.com/year/2017,1,0
2294636,16043817,Beijing enjoys best winter air quality in five years,story,gpetukhov,2018-01-01 0:15,http://www.scmp.com/news/china/policies-politics/article/2126104/beijing-enjoys-best-winter-air-quality-five-years#comments,2,0
2294637,16043825,Ask HN: Any domain name registrars that don't require JavaScript?,ask_hn,glockenspielen,2018-01-01 0:16,,1,2
2294638,16043845,"Controversial Therapy Has Led to Death Threats, Harassment and Pseudoscience",story,cpncrunch,2018-01-01 0:23,https://www.buzzfeed.com/tomchivers/inside-the-controversial-therapy-for-chronic-fatigue?utm_term=.hhvJ82eqm#.gx0OxV1RL,2,0
2294639,16043851,Ruby 3x3 – Ruby 3 Will Be 3 Times Faster – What's News?,story,geraldbauer,2018-01-01 0:25,https://planetruby.github.io/advent2017/ruby3x3,2,0
